{"digest":"sha256-f06314315253ba806d71fdef43420ece9c9e2d3c1ff3dcffdb51c020921997ce","kind":"aas.stack-plan","payload":{"catalog":{"integrity":"sha256-1e464d8b3053b349fc16ba5a0f23a7aa4042802362a5a97604b9675846a22e27","package":"agentic-awesome-skills","version":"16.7.0"},"desiredSkills":["antigravity-maintainer-batch-release","invariant-guard","javascript-pro","javascript-testing-patterns","mcp-builder","privacy-by-design","threat-modeling-expert"],"installedState":{"digest":"sha256-eaf741c591ae9eb798b55a703ddadfeec7c803b91b3199272a7ccd39e56160c1","entries":[]},"kind":"aas.stack-plan.payload","manifestDigest":"sha256-8ec3ac559f6af5f6cd288a1c87be009b435f5ef5d4c8beca46e6b52bf8b66528","operations":[{"backupRequired":false,"expectedTreeDigest":null,"kind":"install","resultTreeDigest":"sha256-70d39b1923c616e17f339fc5dd828b8efae62ad818aaa7c1d00fa0e7f4441dbd","skillId":"antigravity-maintainer-batch-release","sourceTreeDigest":"sha256-70d39b1923c616e17f339fc5dd828b8efae62ad818aaa7c1d00fa0e7f4441dbd"},{"backupRequired":false,"expectedTreeDigest":null,"kind":"install","resultTreeDigest":"sha256-12e508cace558f64b5d90c777c94e42373788240bed683f487d8c3c1730b7d19","skillId":"invariant-guard","sourceTreeDigest":"sha256-12e508cace558f64b5d90c777c94e42373788240bed683f487d8c3c1730b7d19"},{"backupRequired":false,"expectedTreeDigest":null,"kind":"install","resultTreeDigest":"sha256-8080fc8393388ea32d372d158df1a015f9f2d8b6bea79c77e21dede367e1be30","skillId":"javascript-pro","sourceTreeDigest":"sha256-8080fc8393388ea32d372d158df1a015f9f2d8b6bea79c77e21dede367e1be30"},{"backupRequired":false,"expectedTreeDigest":null,"kind":"install","resultTreeDigest":"sha256-bdd2f4f8a1ad760fe03e48db0e7b05680d83c8401371fa9fc8ed60ba80d84f68","skillId":"javascript-testing-patterns","sourceTreeDigest":"sha256-bdd2f4f8a1ad760fe03e48db0e7b05680d83c8401371fa9fc8ed60ba80d84f68"},{"backupRequired":false,"expectedTreeDigest":null,"kind":"install","resultTreeDigest":"sha256-522d2e050388a95d1704e1909bbe5be5833f47663cf7463fc6af56baae3bcbea","skillId":"mcp-builder","sourceTreeDigest":"sha256-522d2e050388a95d1704e1909bbe5be5833f47663cf7463fc6af56baae3bcbea"},{"backupRequired":false,"expectedTreeDigest":null,"kind":"install","resultTreeDigest":"sha256-9448624d5264260b1729138a11ae6754b67f3c52780b19334aea799df552f0d9","skillId":"privacy-by-design","sourceTreeDigest":"sha256-9448624d5264260b1729138a11ae6754b67f3c52780b19334aea799df552f0d9"},{"backupRequired":false,"expectedTreeDigest":null,"kind":"install","resultTreeDigest":"sha256-9a51f69bd7ddfbed348ffcee4e5ae4052bea405fdf71816854c521aef2dcb82e","skillId":"threat-modeling-expert","sourceTreeDigest":"sha256-9a51f69bd7ddfbed348ffcee4e5ae4052bea405fdf71816854c521aef2dcb82e"}],"overrides":[],"profile":{"constraints":["Defensive local source and isolated fixtures only; no live target probing or payload execution"],"frameworks":["Node.js","MCP"],"goals":["Review catalog-bound bundle reads, path containment and inert bounded output"],"languages":["JavaScript"],"projectType":"local-mcp-server"},"runtime":{"closureDigest":"sha256-b0a58dc27dc7bf9141b567335b5324b7c553274fdbd30452de091f60d54a342a","integrity":"sha512-awAl3r7uiGXq3b/WRNNVoiODoz8nG9oZkT8iT7g7B5ARhcMSecJ+NeNfBymDmIh3xZ5rogT5txHtGqWxcS1VDQ==","package":"agentic-awesome-skills","version":"16.7.0"},"schemaVersion":2,"stateCommit":{"nextDigest":"sha256-760f097b3a8d5e9428550509c0cbb8f28eac0691a3ceea76083d563fc75a5331","position":"final","previousDigest":"sha256-eaf741c591ae9eb798b55a703ddadfeec7c803b91b3199272a7ccd39e56160c1"},"target":{"adapterVersion":"1.0.0","host":"codex","identityDigest":"sha256-7ebdd3bfdd76222c1dfe60467a0d235d184c1cec1dd74bc45db55e3c6d68b2ca","scope":"project"},"versions":{"catalogSchemaVersion":"2.0.0","coreVersion":"2.0.0","protocolVersion":"2025-06-18"}},"schemaVersion":2}
