{"digest":"sha256-293699caa0418554daaa9e69ff7f0325dadd287690da2c31e759b673a30a6a17","kind":"aas.stack-plan","payload":{"catalog":{"integrity":"sha256-1e464d8b3053b349fc16ba5a0f23a7aa4042802362a5a97604b9675846a22e27","package":"agentic-awesome-skills","version":"16.7.0"},"desiredSkills":["antigravity-maintainer-batch-release","cross-platform-contract-propagation-audit","invariant-guard","javascript-pro","javascript-testing-patterns","mcp-builder","privacy-by-design"],"installedState":{"digest":"sha256-eaf741c591ae9eb798b55a703ddadfeec7c803b91b3199272a7ccd39e56160c1","entries":[]},"kind":"aas.stack-plan.payload","manifestDigest":"sha256-00747b7401376c63bea313b561b16a665a5e6043629a98384296caefab0ce13c","operations":[{"backupRequired":false,"expectedTreeDigest":null,"kind":"install","resultTreeDigest":"sha256-70d39b1923c616e17f339fc5dd828b8efae62ad818aaa7c1d00fa0e7f4441dbd","skillId":"antigravity-maintainer-batch-release","sourceTreeDigest":"sha256-70d39b1923c616e17f339fc5dd828b8efae62ad818aaa7c1d00fa0e7f4441dbd"},{"backupRequired":false,"expectedTreeDigest":null,"kind":"install","resultTreeDigest":"sha256-0973457a5f6163629c9aa7d6d85a7b89b0b9225a428a5065004a34f4a22c3886","skillId":"cross-platform-contract-propagation-audit","sourceTreeDigest":"sha256-0973457a5f6163629c9aa7d6d85a7b89b0b9225a428a5065004a34f4a22c3886"},{"backupRequired":false,"expectedTreeDigest":null,"kind":"install","resultTreeDigest":"sha256-12e508cace558f64b5d90c777c94e42373788240bed683f487d8c3c1730b7d19","skillId":"invariant-guard","sourceTreeDigest":"sha256-12e508cace558f64b5d90c777c94e42373788240bed683f487d8c3c1730b7d19"},{"backupRequired":false,"expectedTreeDigest":null,"kind":"install","resultTreeDigest":"sha256-8080fc8393388ea32d372d158df1a015f9f2d8b6bea79c77e21dede367e1be30","skillId":"javascript-pro","sourceTreeDigest":"sha256-8080fc8393388ea32d372d158df1a015f9f2d8b6bea79c77e21dede367e1be30"},{"backupRequired":false,"expectedTreeDigest":null,"kind":"install","resultTreeDigest":"sha256-bdd2f4f8a1ad760fe03e48db0e7b05680d83c8401371fa9fc8ed60ba80d84f68","skillId":"javascript-testing-patterns","sourceTreeDigest":"sha256-bdd2f4f8a1ad760fe03e48db0e7b05680d83c8401371fa9fc8ed60ba80d84f68"},{"backupRequired":false,"expectedTreeDigest":null,"kind":"install","resultTreeDigest":"sha256-522d2e050388a95d1704e1909bbe5be5833f47663cf7463fc6af56baae3bcbea","skillId":"mcp-builder","sourceTreeDigest":"sha256-522d2e050388a95d1704e1909bbe5be5833f47663cf7463fc6af56baae3bcbea"},{"backupRequired":false,"expectedTreeDigest":null,"kind":"install","resultTreeDigest":"sha256-9448624d5264260b1729138a11ae6754b67f3c52780b19334aea799df552f0d9","skillId":"privacy-by-design","sourceTreeDigest":"sha256-9448624d5264260b1729138a11ae6754b67f3c52780b19334aea799df552f0d9"}],"overrides":[],"profile":{"constraints":["offline runtime","bounded inputs","agent-owned selection","no release or installation"],"frameworks":["node"],"goals":["review-mcp-contract"],"languages":["javascript"],"projectType":"Local read-only Node MCP catalog"},"runtime":{"closureDigest":"sha256-b0a58dc27dc7bf9141b567335b5324b7c553274fdbd30452de091f60d54a342a","integrity":"sha512-awAl3r7uiGXq3b/WRNNVoiODoz8nG9oZkT8iT7g7B5ARhcMSecJ+NeNfBymDmIh3xZ5rogT5txHtGqWxcS1VDQ==","package":"agentic-awesome-skills","version":"16.7.0"},"schemaVersion":2,"stateCommit":{"nextDigest":"sha256-a6cf5b649bfb627cbb74f43e9c86e5d7c273f83a7f8965eb908cc27c73124229","position":"final","previousDigest":"sha256-eaf741c591ae9eb798b55a703ddadfeec7c803b91b3199272a7ccd39e56160c1"},"target":{"adapterVersion":"1.0.0","host":"codex","identityDigest":"sha256-6025cefc693f8c13441ed3507a1088d4872b45280a754611d68b851f89f210b3","scope":"project"},"versions":{"catalogSchemaVersion":"2.0.0","coreVersion":"2.0.0","protocolVersion":"2025-06-18"}},"schemaVersion":2}
