{"digest":"sha256-856ade4515e181577c518f901e947c7f827d385bcd8f4376e73ffea3b2ec372e","kind":"aas.stack-plan","payload":{"catalog":{"integrity":"sha256-1e464d8b3053b349fc16ba5a0f23a7aa4042802362a5a97604b9675846a22e27","package":"agentic-awesome-skills","version":"16.7.0"},"desiredSkills":["antigravity-maintainer-batch-release","fixing-accessibility","invariant-guard","privacy-by-design","react-patterns","typescript-pro","vitest-skill"],"installedState":{"digest":"sha256-eaf741c591ae9eb798b55a703ddadfeec7c803b91b3199272a7ccd39e56160c1","entries":[]},"kind":"aas.stack-plan.payload","manifestDigest":"sha256-3eb8e1a07cd328a91ef93ab0e40f19d07d7d3d7a306391a9c91e94aac4c5d073","operations":[{"backupRequired":false,"expectedTreeDigest":null,"kind":"install","resultTreeDigest":"sha256-70d39b1923c616e17f339fc5dd828b8efae62ad818aaa7c1d00fa0e7f4441dbd","skillId":"antigravity-maintainer-batch-release","sourceTreeDigest":"sha256-70d39b1923c616e17f339fc5dd828b8efae62ad818aaa7c1d00fa0e7f4441dbd"},{"backupRequired":false,"expectedTreeDigest":null,"kind":"install","resultTreeDigest":"sha256-6f6d2870903274d8ea7d1f2290235c5b08d55f9d8a934d6e40330de952858173","skillId":"fixing-accessibility","sourceTreeDigest":"sha256-6f6d2870903274d8ea7d1f2290235c5b08d55f9d8a934d6e40330de952858173"},{"backupRequired":false,"expectedTreeDigest":null,"kind":"install","resultTreeDigest":"sha256-12e508cace558f64b5d90c777c94e42373788240bed683f487d8c3c1730b7d19","skillId":"invariant-guard","sourceTreeDigest":"sha256-12e508cace558f64b5d90c777c94e42373788240bed683f487d8c3c1730b7d19"},{"backupRequired":false,"expectedTreeDigest":null,"kind":"install","resultTreeDigest":"sha256-9448624d5264260b1729138a11ae6754b67f3c52780b19334aea799df552f0d9","skillId":"privacy-by-design","sourceTreeDigest":"sha256-9448624d5264260b1729138a11ae6754b67f3c52780b19334aea799df552f0d9"},{"backupRequired":false,"expectedTreeDigest":null,"kind":"install","resultTreeDigest":"sha256-d4106bf0b7431c78829f887e6a4268af5bb8b2c8dd8b7eca014302fa9db4b68e","skillId":"react-patterns","sourceTreeDigest":"sha256-d4106bf0b7431c78829f887e6a4268af5bb8b2c8dd8b7eca014302fa9db4b68e"},{"backupRequired":false,"expectedTreeDigest":null,"kind":"install","resultTreeDigest":"sha256-566bcd23a28dd2a0ab5df2705c2b3d78fb1dc93ea2e82f7328ba0d5a19dbb950","skillId":"typescript-pro","sourceTreeDigest":"sha256-566bcd23a28dd2a0ab5df2705c2b3d78fb1dc93ea2e82f7328ba0d5a19dbb950"},{"backupRequired":false,"expectedTreeDigest":null,"kind":"install","resultTreeDigest":"sha256-5bb5aa70759140238cbc27e179a40185b4c6c799e45676c5e7788712610e6dd6","skillId":"vitest-skill","sourceTreeDigest":"sha256-5bb5aa70759140238cbc27e179a40185b4c6c799e45676c5e7788712610e6dd6"}],"overrides":[],"profile":{"constraints":["Local review only; no project uploads, installation or deployment"],"frameworks":["React","Vite","Vitest"],"goals":["Verify Workbench import boundaries, artifact bindings and accessible error states"],"languages":["TypeScript"],"projectType":"web-app"},"runtime":{"closureDigest":"sha256-b0a58dc27dc7bf9141b567335b5324b7c553274fdbd30452de091f60d54a342a","integrity":"sha512-awAl3r7uiGXq3b/WRNNVoiODoz8nG9oZkT8iT7g7B5ARhcMSecJ+NeNfBymDmIh3xZ5rogT5txHtGqWxcS1VDQ==","package":"agentic-awesome-skills","version":"16.7.0"},"schemaVersion":2,"stateCommit":{"nextDigest":"sha256-b0a7467f271d8737f04a43782ce2619107d08e358df29f7b8277facaec9f3a47","position":"final","previousDigest":"sha256-eaf741c591ae9eb798b55a703ddadfeec7c803b91b3199272a7ccd39e56160c1"},"target":{"adapterVersion":"1.0.0","host":"codex","identityDigest":"sha256-f76cac58f05de0e53e697a13320a233e797ec255b3fcb2a00312a7426dbb4bbd","scope":"project"},"versions":{"catalogSchemaVersion":"2.0.0","coreVersion":"2.0.0","protocolVersion":"2025-06-18"}},"schemaVersion":2}
